objectid,title,title-es,creator,description-en,description-es,date,location-en,location-es,Latitude,Longitude,subject-en,subject-es,tags-en,tags-es,source,type,format,rights,rightsstatement,object_location,filename
latchbo0061,Marina's Muumuu,El muumuu de Marina,Evangelina Vigil-Piñón; Pablo Torrecilla,"Marina has always dreamed of having a colorful muumuu, the traditional dress of Hawaiian people, and finally goes to the bustling downtown with her grandmother to buy the fabric.",,2001,"San Antionio, Texas","San Antonio, Texas; Madrid, España",29.43045738,-98.50924795,Clothing and dress-Hawaii--Fiction; Racially mixed people--Fiction; Spanish language materials--Bilingual,Ropa y vestido--Hawai--Ficción; Gente mesitza--Ficción; Materiales en español–Bilingüe,Hawaii; Biracial; Muumuus; Sewing; Grandmother and granddaughter; Colorful fabric; Tropical fabric,Hawai; Birracial; Muumuus; cosiendo; Abuela y nieta; tela de colores; tela tropical,,Image; StillImage,image/jpeg,Arte Público Press,,,latchbo0061.jpg
latchbo0062,Maxy Survices the Hurricane,Maxy sobrevive el huracán,Ricia Anne Chansky / Yarelis Marcial Acevedo; Olga Barinova,"Maxy the dog survives Hurricane Maria, and like many who go through natural diasters, he is latter terrified of storms and rain.",,2021,"Mayagüez, Puerto Rico","Mayagüez, Puerto Rico; Calgary, Canada",18.19029253,-67.13640792,"Dogs--Fiction; Fear--Fiction; Hurricane Maria, 2017--Fiction; Puerto Rico--Fiction; Spanish language materials--Bilingual","Perros--Ficción; Miedo--Ficción; Huracán Maria, 2017--Ficción; Puerto Rico--Ficción; Materiales en español--Bilingüe",Puerto Rico; Natural Diasters; Hurricane Maria; Fears; Dogs,Puerto Rico; desastres naturales; Huracán Maria; miedos; Perros,,Image; StillImage,image/jpeg,Arte Público Press,,,latchbo0062.jpg
latchbo0063,Maya and Annie on Saturdays and Sundays,Los sábados y domingos de Maya y Annie,Gwendolyn Zepeda; Thelma Muraida,"Told in two voices and languages, Vietnamese American Annie and Hispanic American Maya attend different schools but spend nearly every weekend together, until something special happens to bring them closer together.",,2018,"Houston, Texas","Houston, Texas; San Antonio, Texas",29.7535998,-95.35739879,Friendship--Fiction; Hispanic Americans--Fiction; Vietnamese Americans--Fiction; Single-parent families--Fiction; Remarriage--Fiction; Spanish language materials--Bilingual,Amistad--Ficción; Hispanoamericanos--Ficción; Vietnamita Americano--Ficción; Familias monparentales--Ficción; Segundas nupcias--Ficción; Materiales en español--Bilingüe,Blended families; Marriage; Friends; Sisters; Step-sisters; Vietnamese culture; Latino/a culture,familias mixtas; matrimonio; amigos; hermanas; hermanastras; cultura vietnamita; cultura Latino/a,,Image; StillImage,image/jpeg,Arte Público Press,,,latchbo0063.jpg
latchbo0064,Mayanito's New Friends,Los nuevos amigos de Mayanito,"Jesús Abraham ""Tato"" Laviera; Gabhor Utomo",Mayanito travels from his mountain top village of his tribe to befriend the animals of the jungle and the human children of the village below.,Mayanito viaja de la villa de su tribu en la cima de una montaña para amistarse con los animales de la selva y los niños humanos que viven en la villa al pie de la montaña.,2017,"Santurce, Puerto Rico","Santurce, Puerto Rico; Manhattan, Nueva York; Indonesia; Portland, Oregon",18.46721251,-66.11721872,Mayans--Fiction; Friendship--Fiction; Traveling--Fiction; Spanish language materials--Bilingual,Mayans--Ficción; Amistad--Ficción; Materiales en español--Bilingüe,Friendship; Diversity; Music; Animals; Mayans; Indigenous,Amistad; diversidad; música; animales; mayas; indígena,,Image; StillImage,image/jpeg,Arte Público Press,,,latchbo0064.jpg
latchbo0065,Mayte and the Bogeyman,Mayte y el Cuco,Acosta González; Christina Rodriguez,"Mayte loves to look and listen to the street vendors as they pass by; except for Don Aparicio, the ice cream vendor, whom she and her best friend believe is actually El Cuco, the Bogeyman.",,2006,"Río Piedras, Puerto Rico","Río Piedras, Puerto Rico; San Antonio, Texas; Stillwater, Minnesota",18.38972246,-66.04126846,Street vendors--Fiction; The Bogeyman--Fiction; Hispanic Americans--Fiction; Spanish language materials--Bilingual,Vendedores de calle--Ficción; El Cuco--Ficción; Hispanoamericanos--Ficción; Materiales en español--Bilingüe,The Bogeyman; The Boogeyman; Street Vendors; Ice Cream; Best Friends; Folklore of Latin Americas,El Cuco; El Cucuy; vendedores de calle; helado; mejor amigos; folklore de Americas Latinas,,Image; StillImage,image/jpeg,Arte Público Press,,,latchbo0065.jpg
latchbo0066,Mimí's Parranda,La parranda de Mimí,Lydia M. Gil; Hernán Sosa,"Mimí is excited for her family's annual trip to Puerto Rico, especially for the food and parrandas, during the Christmas holiday; and she is disappointed when her mother tells her they will be not be going this Christmas.",,2006,"Mayagüez, Puerto Rico","Mayagüez, Puerto Rico; Denver, Colorado; Samuhú, Argentina",18.19029253,-67.13640792,Christmas--Fiction; Parrandas--Fiction; Puerto Rico--Fiction; Hispanic American--Fiction; Spanish language materials--Bilingual,Navidad--Ficción; Parrandas--Ficción; Puerto Rico--Ficción; Hispanoamericanos--Ficción; Materiales en español--Bilingüe,Christmas; Puerto Rico; Parrandas; Christmas Party; Friends; Music; Family; Traditional food,Navidad; Puerto Rico; Parrandas; Fiesta de Navidad; Amigos; Música; Familia; Comida tradicional,,Image; StillImage,image/jpeg,Arte Público Press,,,latchbo0066.jpg
latchbo0067,Mother Fox and Mr. Coyote,Mamá Zorra y Don Coyote,Victor Villaseñor; Felipe Ugalde Alcántara,Mamá Zorra distracts a hungry coyote from eating her and her three cubs by persuading him that the moon's reflection in  a pond is actually a giant wheel of cheese.,,2004,"Carlsbad, California","Carlsbad, California; Oceanside, California; Cuidad de México, México",33.16052951,-117.3507665,Foxes--Folklore; Coyote--Folklore; Moon--Folklore; Follklore--Mexico; Spanish language materials--Bilingual.,Zorros--Folklore; Coyote--Folklore; La luna--Folklore; Folklore--México; Materiales en español--Bilingüe,Mexican Folktale; Folklore; Indigenous; Fox; Coyote; Moon,Cuentos folclóricos Mexicanos; Folklore; indígena; Zorro; Coyote; La Luna;,,Image; StillImage,image/jpeg,Arte Público Press,,,latchbo0067.jpg
latchbo0068,Muffler Man,El hombre mofle,Tito Campos; Lamberto and Beto Alvarez,"Chuy works hard at the muffler shop to earn enough money to join his father in America, where together they create an army of ""muffler men,"" statues made from old muffler parts, that they scatter around the city.",,2001,"Los Angeles, California","Los Angeles, California; Dallas, Texas; Fort Worth, Texas",34.05464511,-118.2438575,Fathers and sons--Fiction; Sculpture--Fiction; Mexican Americans--Fiction; Spanish language materials--Bilingual,Padres y hijos--Ficción; Esculturas--Ficción; Mexicano americanos--Ficción; Materiales en español--Bilingüe,Immigrants; Mexico; Borders; Art; Artist; Sculptures; Sculptor; Mufflers; Cars;,Inmigrantes; México; Fronteras; Artes; Artisita; Esculturas; Mofles,,Image; StillImage,image/jpeg,Arte Público Press,,,latchbo0068.jpg
latchbo0069,My Big Sister,Mi hermana mayor,Samule Caraballo; Thelma Muraida,"Before and after school, Anita takes wonderful care of her little brother while their parents work in a factory, sewing jeans.",,2012,"Vieques, Puerto Rico","Vieques, Puerto Rico; Virginia;  San Antonio, Texas ",18.14725676,-65.44500157,Brother and sisters--Fiction; Hispanic Americans--Fiction; Spanish language materials--Bilingual,Hermanos y hermanas--Ficción; Hispanoamericanos--Ficción; Materiales en español--Bilingüe,Factory work; immigrants; jeans; siblings; older sister;,Trabajo de fabrica; inmigrantes; pantalones; hermanos; hermana mayor,,Image; StillImage,image/jpeg,Arte Público Press,,,latchbo0069.jpg
latchbo0070,My Grandparents and I,Mis abuelos y yo,Samuel Caraballo; D. Nina Cruz,"Told in verse,  a young boy narrates his close relationship with his grandparents throughout the seasons.",,2004,"Vieques, Puerto Rico","Vieques, Puerto Rico; Virginia; Nueva Jersey",18.14725676,-65.44500157,Grandparents--Fiction; Seasons--Fiction; Puerto Rico--Fiction; Stories in rhyme; Spanish lanuage materials--Bilingual,Abuelos--Ficción; Estaciones--Ficción; Puerto Rico--Ficción; Cuentos en rima; Materiales en español--Bilingüe,Puerto Rico; Puerto Rican; Verse; Rhyming; Seasons; Grandchild; Grandparents,Puerto Rico; Puertorriqueños; Verso; Rima; Estaciones; Nietos; Abuelos,,Image; StillImage,image/jpeg,Arte Público Press,,,latchbo0070.jpg
latchbo0071,My Parents: Heroes of the Harvest,Mis papitos: Héroes de la cosecha,Samuel Caraballo; Obed Gómez,"A young boy speaks lovingly of his parents, who toil in the fields all day long harvesting fruits and vegetables, and return home in the evening for a well-deserved rest.",,2005,"Vieques, Puerto Rico","Vieques, Puerto Rico; Virginia; Santurce, Puerto Rico; Orlando, Florida",18.14725676,-65.44500157,Parents--Fiction; Harvesting--Fiction; Farm life--Fiction; Stories in rhyme; Spanish language materials--Bilingual,Padres--Ficción; Cosechando--Ficción; Vida de granja--Ficción; Cuentos en rima; Materiales en español--Bilingüe,Puerto Rico; Puerto Rican; Rhyming; Farm Workers; Agriculture;,Puerto Rico; Puertorriqueños; Rima; Trabajadores agrícolas; agricultura,,Image; StillImage,image/jpeg,Arte Público Press,,,latchbo0071.jpg
latchbo0072,My Shoes and I: Crossing Three Borders,Mi Zapatos y yo: Cruzando tres fronters,René Colato Laínez; Fabricio Vaden Broeck,"As a boy and his Papá travel from El Salvador to the United States to be reunited with Mamá, his wonderful new shoes help to distract him from the long and difficult journey",,2019," San Salvador, El Salvador","San Salvador; El Salvador; Cuidad de Guatemala, Guatemala; Cuidad de México, México; Los Angeles, California",13.69473844,-89.19138814,Travel--Fiction; Emigration and immigration--Fiction; Shoes--Fiction; Fathers and sons--Fiction; Central America--Fiction; Spanish language materials--Bilingual,Enmigración y Inmigración--Ficción; Zapatos--Ficción; Padres y hijos--Ficción; Centroamėrica--Ficción; Materiales en español--Bilingüe,Shoes; Border; Immigration; Immigrants; Real experience; Desert; Mountains; Rivers,Zapatos; Fronteras; Inmigración; Inmigrantes; experiencias reales; Desierto; Montañas; Rios,,Image; StillImage,image/jpeg,Arte Público Press,,,latchbo0072.jpg
latchbo0073,My Sister Dulce's Birthday,El Cumpleaños de mi hermana Dulce,Erika Said; Claudia Navarro,Dulce must choose which candies to put in her piñata for her birthday party without them getting squished.,,2022,"Houston, Texas","Houston, Texas; Cuidad de México, México ",29.7535998,-95.35739879,Parties--Fiction; Birthdays--Fiction; Spanish language materials--Bilingual,Fiestas--Ficción; Cumpleaños--Ficción; Materiales en español--Bilingüe,Birthday parties; Sisters; Piñatas; Candy; Mexican Treats,fiestas de cumpleaños; Hermanas; Piñatas; dulce; golosinas mexicanas,,Image; StillImage,image/jpeg,Arte Público Press,,,latchbo0073.jpg
latchbo0074,My Tata's Guitar,La guitarra de mi tata,Ethriam Cash Brammer; Daniel Lechón,"While sharing stories of their Mexican-American family's past, a grandfather gives his grandson the guitar he received from his own father. ",,2003,"El Centro, California","El Centro, California; Detroit, Michigan; Houston, Texas",32.79170078,-115.5627075,Guitar--Fiction; Fathers and sons--Fiction; Mexican Americans--Fiction; Spanish language materials--Bilingual,Guitarra--Ficción; Padres y hijos--Ficción; Mexicanos americanos--Ficción; Materiales en español--Bilingüe,Grandfathers; Guitars; Memories; Generational; Music; Singing; Family history,abuelos; guitarras; recuerdos; generacional; Música; cantando; historia de familia,,Image; StillImage,image/jpeg,Arte Público Press,,,latchbo0074.jpg
latchbo0075,No Time for Monsters,No Hay Tiempo para monstruos,Spelile Rivas; Valeria Cervantes,"Each time Mamá asks Roberto to help around the house, he claims to be afraid that a monster will take him away.",,2010,"Houston, Texas","Houston, Texas; Arlington, Texas; Cuidad de México, México",29.7535998,-95.35739879,Housekeeping--Fiction; Behavior--Fiction; Monsters--Fiction; Spanish language materials--Bilingual,Limpieza interna--Ficción; Conducta--Ficción; Monstruos--Ficción; Materiales en español--Bilingüe,Chores; Complaining; Avoiding; Reluctantly; Monsters;,quehaceres; quejumbroso; evitando; reacio; monstruos,,Image; StillImage,image/jpeg,Arte Público Press,,,latchbo0075.jpg
latchbo0076,"Oh, Divine Catrina",La divina Catrina,Aracely De Alvarado; Claudia Navarro,"Catrina, a Mexican skeleton, searches for just the right outfit to wear to a Day of the Dead dance in this bilingual picture book for children ages 5-8",,2020,"Monterrey,  Nuevo León, Mexico","Monterrey, Nuevo León, México; California; Cuidad de México, México",25.689857,-100.3159419,Skeleton--Fiction; Clothing and dress--Fiction; All Souls' Day--Fiction; Spanish language materials--Blingual,Esqueletos--Ficción; Ropa y vesitido--Ficción; El Día de los Muertos--Ficción; Materiales en español--Bilingüe,Day of the Dead; Skeletons; Mexico; La Catrina; Dressing Up; Flowers; clothing,Día de los Muertos; esqueletos; México; La Catrina; vestirse; flores; ropa,,Image; StillImage,image/jpeg,Arte Público Press,,,latchbo0076.jpg
latchbo0077,Pepita and the Bully,Pepita y la peleonera,Ofelia Duma Lachtman; Alex Pardo DeLange,"After a mean-spirited girl bullies her for three days in a row, Pepita no longer wants to go to her new school. ",,2011,"Los Angeles, California","Los Angeles, California; Caracas, Venezuela; Gainesville, Florida",34.0507663,-118.2648393,Bullies--Fiction; Schools--Fiction; Hispanic Americans--Fiction; Spanish language materials--Bilingual,Peleoneros--Ficción; Escuelas--Ficción; Hispanoamericanos--Ficción; Materiales en español--Bilingüe,New School; Bullies; Bullying; Mean Comments; Challenges; Kindness,Nueva escuela; peleoneros; intimidación; prejuicios; amabilidad,,Image; StillImage,image/jpeg,Arte Público Press,,,latchbo0077.jpg
latchbo0078,Pepita Finds Out,Lo que Pepita descubre,Ofelia Duma Lachtman; Alex Pardo DeLange,"Pepita is afraid that her report about her family members may not be interesting, but she ultimately realizes that all of them play an important role in her life.",,2002,"Los Angeles, California","Los Angeles, California; Caracas, Venezuela; Gainesville, Florida",34.0507663,-118.2648393,Family life--Fiction; Spanish language materials--Bilingual,Vida de familia--Ficción; Materiales en español--Bilingüe,School reports; Family; Questions; Gardening; Fathers and daughters,reportes de escuela; familia; preguntas; jardiendo; padres y hijas,,Image; StillImage,image/jpeg,Arte Público Press,,,latchbo0078.jpg
latchbo0079,Pepita on Pepper Street,Pepita en la calle Pepper,Ofelia Duma Lachtman; Alex Pardo DeLange,"Pepita, unhappy about her family's move to a street where everything is new to her, is not very friendly to her neighbors as they pass by, but later has another chance to make friends.",,2008,"Los Angeles, California","Los Angeles, California; Caracas, Venezuela; Gainesville, Florida",34.0507663,-118.2648393,"Moving, Household--Fiction; Hispanic Americans--Fiction; Neighborhood--Fiction; Spanish language materials--Bilingual","Mudarse, Casa de--Ficción; Hispanoamericanos--Ficción; Barrios--Ficción; Materiales en español--Bilingüe",Moving; Introductions; Neighborhood; New friends; New neighbords; New people,Mudarse; Introduciones; Barrios; Nuevo amigos; Nuevo vecinos; Nueva gente,,Image; StillImage,image/jpeg,Arte Público Press,,,latchbo0079.jpg
latchbo0080,Pepita Packs Up,Pepita empaca,Ofelia Duma Lachtman; Alex Pardo DeLange,"As her family prepare to move to a new home, Pepita refuses to pack her toys or say goodbye to anyone, because saying goodbye might make her cry.",,2005,"Los Angeles, California","Los Angeles, California; Caracas, Venezuela; Gainesville, Florida",34.0507663,-118.2648393,Moving Household--Fiction; Hispanic Americans--Fiction; Neighborhood--Fiction; Spanish language materials--Bilingual,Mudarse de casa--Ficción; Hispanoamericanos--Ficción; Barrios--Ficción; Materiales en español--Bilingüe,Moving; Goodbye; Change; Community; Packing; Crying,mudarse; despedida; cambiar; comunidad; empacando; llorando; ,,Image; StillImage,image/jpeg,Arte Público Press,,,latchbo0080.jpg
latchbo0081,Pepita Takes Time,Pepita siempre tarde,Ofelia Duma Lachtman; Alex Pardo DeLange,"Pepita thinks it doesn't matter that she is always late, until she finally realizes how her tardiness affects other people and herself.",,2001,"Los Angeles, California","Los Angeles, California; Caracas, Venezuela; Gainesville, Florida",34.0507663,-118.2648393,Tardiness--Fiction; Behavior--Fiction; Hispanic Americans--Fiction; Interpersonal relations--Fiction; Spanish language materials--Bilingual,Tardanza--Ficción; Conducta--Ficción; Hispanoamericanos--Ficción; Realciones interpersonales--Ficción; Materiales en español--Bilingüe,Late; Tardiness; Moral; Lesson; Friendship; Behavior,Tarde; tardanza; lección; moral; Amistad; Conducta,,Image; StillImage,image/jpeg,Arte Público Press,,,latchbo0081.jpg
latchbo0082,Pepita Talks Twice,Pepita habla dos veces,Ofelia Duma Lachtman; Alex Pardo DeLange,"Pepita, a little girl who can converse in Spanish adn English, decides not to ""speak twice"" until unanticipated problems cause her to think twice about her decision.",,1995," Los Angeles, California","Los Angeles, California; Caracas, Venezuela; Gainesville, Florida",34.0507663,-118.2648393,Bilingualism--Fiction; Spanish language--Fiction; English language--Fiction; Decision making--Fiction; Hispanic Americans--Fiction,Bilingüismo--Ficción; Español--Ficción; Ingles--Ficción; Tomando decisiones--Ficción; Hispanoamericanos--Ficción,Language; Speaking; Bilingualism; Bilingual; English; Spanish; Two languages,lenguas; hablando; bilingüismo; bilingüe; inglés; español; dos lenguas,,Image; StillImage,image/jpeg,Arte Público Press,,,latchbo0082.jpg
latchbo0083,Pepita Thinks Pink,Pepita y el color rosado,Ofelia Duma Lachtman; Alex Pardo DeLange,Pepita does not like the color pink and is dismayed to learn that it is the favorite color of the little girl who moves in next door.,,1998,"Los Angeles, California","Los Angeles, California; Caracas, Venezuela; Gainesville, Florida",34.0507663,-118.2648393,Pink--Fiction; Color--Fiction; Prejudices--Fiction; Friendship--Fiction; Mexican American--Fiction; Spanish language materials--Bilingual,Rosado--Ficción; Color--Ficción; Prejuicios--Ficción; Amistad--Ficción; Mexicano americanos--Ficción; Materiales en español--Bilingüe,Colors; Pink; Balloons; Neighbors; Differences; Friendship,Colores; Rosado; globos; vecinos; diferencias; amistad,,Image; StillImage,image/jpeg,Arte Público Press,,,latchbo0083.jpg
latchbo0084,Remembering Grandma,Recordando a Abuela,Teresa Armas; Pauline Rodriguez Howard,Lorena remembers the moments she spent together with her grandmother before her death and helps her granfather find peace.,,2003,"Hacienda Heights, California","Hacienda Heights, California; San Antonio, Texas",33.99411113,-117.9669706,Grandparents--Fiction; Hispanic Americans--Fiction; Spanish language materials--Bilingual,Abuelos--Ficción; Hispanoamericanos--Ficción; Materiales en español--Bilingüe,Grandmother; Death; Grief; Acceptance; Memories; Sentimental objects; Grandfather; Flower garden,abuelas; muerte; dolor; aceptando; recuerdos; objetos de sentimiento; abuelos; jardín de flores,,Image; StillImage,image/jpeg,Arte Público Press,,,latchbo0084.jpg
latchbo0085,René Has Two Last Names,René tiene does apellidos,René Colato Laínez; Fabiola Graullera Ramírez,"In this story based on the author's childhood, a young Salvadoran immigrant is teased for having two last names until he presents his family tree project celebrating his heritage.",,2009,"San Salvador, El Salvador","El Salvador; Los Angeles, California; Cuidad de México, México",13.69473844,-89.19138814,"Salvadoran Americans--Juvenile fiction; Salvadoran Americans--Fiction; Immigrants--Fiction; Names, Personal--Fiction; Schools--Fiction; Spanish language materials--Bilingual",Salvadoreños americanos--Ficción juvenil; Salvadoreños americanos--Ficción; Inmigrantes--Ficción; Nombres; Personal--Ficción; Escuelas--Ficción; Materiales en español--Bilingüe,Last Names; Two Last Names; Differences; El Salvador; Immigrants; School Project; Family Tree; Grandparents,apellidos; dos apellidos; diferencias; El Salvador; inmigrantes; proyecto de escuela; árbol de familia; abuelos,,Image; StillImage,image/jpeg,Arte Público Press,,,latchbo0085.jpg
latchbo0086,Ricardo's Race,La carrera de Ricardo,Diane Gonzales Bertrand; Anthony Accardo,"A biographical description of Dr. Ricardo Romo's early life, sportmanship, and education before becoming the President of UTSA.",,2007,"San Antonio, Texas","San Antonio, Texas; Austin, Texas; Los Angeles, California; Brooklyn, Nueva York",29.43045738,-98.50924795,"Romo, Ricardo--Juvenile literature; Hispanic American educators--Biography--Juvenile literature; Educators--United States--Biography--Juvenile literature; University of Texas at San Antonio--Presidents--Biography--Juvenile literature; Historians--United States--Biography--Juvenile literature","Romo, Ricardo--Literatura juvenil; Educadores Hispanoamericano--Biografía--Literatura juvenil; Educadores--Estados Unidos--Biografía--Literatura juvenil; Universidad de Texas en San Antonio--Presidentes--Biografía--Literatura juvenil; Historiadores--Estados Unidos--Biografía--Literatura juvenil",Biography; Historical; Education; Educator; Mexican American; Athlete; San Antonio; College,Biografía; histórico; educación; educador; Mexicano americano; atleta; San Antonio; universidad,,Image; StillImage,image/jpeg,Arte Público Press,,,latchbo0086.jpg
latchbo0087,Salsa,Salsa,Lillian Colón-Vilá; Roberta Collier-Morales,"Rita, a young girl living in New York's El Barrio, describes the Afro-Caribbean dance music, salsa, and imagines being a salsa orchestra director.",,1998,"El Barrio, New York",,40.81193289,-73.94568201,Hispanic American--Fiction; Salsa--Fiction; Spanish language materials--Bilingual,Hispanoamericanos--Ficción; Salsa--Ficción; Materiales en español--Bilingüe,Salsa; Dancing; Music; Imagination; Afrolatina; Afrolatine; Afrolatinx; Afro-Caribbean;,Salsa; bailando; Música; imaginación; Afrolatina; Afrolatine; Afrolatinx; Afro-Caribeño,,Image; StillImage,image/jpeg,Arte Público Press,,,latchbo0087.jpg
latchbo0088,Sand and Song: The ABCS of the River,Arenas y Trinos: Acecedario del río,Alma Flor Ada & Rosalma Zubizarreta-Ada; Gabhor Utomo,Short poems for children about rivers and the life found along them.,,2020," Camagüey, Cuba",,21.39234435,-77.90062527,"Stream ecology--Juvenile poetry; Rivers--Juvenile poetry; Children's poetry, American; Stream ecology--Poetry; Rivers--Poetry; American poetry; Spanish language materials--Bilingual",Ecología de arroyos--Poesía juvenil; Ríos--Poesía juvenil; Poesía para niños; Americano; Ecología de arroyos--Poesía; Ríos--Poesía; Poesía Americano; Materiales en español,Rhyming; Poetry; Rivers; Plants; Forest; Animals; Insects; Nature; Sun,rima; poesía; ríos; plantas; bosque; animales; insectos; naturaleza; el sol,,Image; StillImage,image/jpeg,Arte Público Press,,,latchbo0088.jpg
latchbo0089,"Sing, Froggie, Sing","Canta, Rana, Canta",Arte Público Press; Carolyn Dee Flores,"Sing, Froggie, SIng is a folksong that has many versions and is performed wherever Spanish is spoken. It has delighted generations of children while also strengthening their memory.",,2013,"Houston, Texas","Houston, Texas; San Antonio, Texas",29.7535998,-95.35739879,"Frogs--Songs and music; Insects--Songs and music; Animals--Songs and music; Animal sounds--Songs and musics; Folk songs, Spanish; Children's songs; Spanish language materials--Bilingual",Rana--Canciones y música; Insectos--Canciones y música; Animales--Canciones y música; Sonidos de animal--Canciones y música; Canciones folclórico; Español; Canciones para niños; Materiales en español--Bilingüe,Traditonal Folk Song; Spanish; Children; Frogs; Singing; Generational,Cancion tradicional folclórico; Español; Niños; Ranas; Cantando; Generacional,,Image; StillImage,image/jpeg,Arte Público Press,,,latchbo0089.jpg
latchbo0090,"Sip, Slurp, Soup, Soup","Caldo, caldo, caldo",Diane Gonzales Bertrand; Alex Pardo DeLange,A rhythmic text with repetitive phrases relates how the children watch Mamá make soup (recipe included) and go with Papá to get tortillas before enjoying the results of her labor.,,1996,"San Antonio, Texas","San Antonio, Texas; Caracas, Venezuela; Gainesville, Florida",29.43045738,-98.50924795,Soups--Fiction; Tortillas--Fiction; Mexican Americans--Fiction; Family Life--Fiction; Spanish language materials--Bilingual,Caldos--Ficción; Tortillas--Ficción; Mexicano americanos--Ficción; Vida de familia--Ficción; Materiales en español--Bilingüe,Traditional food; Traditional cooking; Soup; Tortillas; Family; Mothers; Fathers; Recipe; Caldo de Res; Mexican,Comida tradicional; Cocinando tradicional; Caldo; Torillas; Familia; Madres; Padres; Receta; Caldo de Res; Mexicano,,Image; StillImage,image/jpeg,Arte Público Press,,,latchbo0090.jpg
