objectid,title,title-es,creator,description-en,description-es,date,location-en,location-es,Latitude,Longitude,subject-en,subject-es,tags-en,tags-es,source,type,format,rights,rightsstatement,object_location,filename
latchbo0091,"Sofi and the Magic, Musical Mural",Sofi y el mágico mural musical ,Raquel M. Ortiz; Maria Dominguez,"On the way back from the bodega, SofÍa is drawn into a life-like mural of Old San Juan where she dances, sings, and conquers her fear of the vejigante before being called back to the barrio by her mother.",,2015,"South Bronx, New York","San Juan, Puerto Rico; San Antón, Ponce, Puerto Rico; South Bronx, Nueva York; Lorain, Ohio; Cataño, Puerto Rico; Cuidad de Nueva York, Nueva York",40.8183186,-73.9166237,Mural painting and decoration--Fiction; Fear--Fiction; Dance--Fiction; San Juan (P.R.)--History--Fiction,Pintura mural y deocración--Ficción; Miedo--Ficción; Bailar--Ficción; San Juan (P.R.)--Historia--Ficción,Mural; Puerto Rico; Puerto Rican; Vejigante; Music; Dancing; Imagination,Mural; Puerto Rico; Puertorriqueño; Vejigante; Música; Bailando; imaginación,,Image; StillImage,image/jpeg,Arte Público Press,,,latchbo0091.jpg
latchbo0092,Sofi Paints Her Dreams,Sofi pinta sus sueños,Raquel M. Ortiz; Roberta Collier-Morales,"After a bad school day, Sofi is transported from a New York City community garden to the Dominican Republic and Haiti , and helps composer Juan Luis and artist Guerlande.",,2019,"New York City, New York","San Pedro de Macorís; República Dominicana; Croix de Bouquets, Haití; Lorain, Ohio; Cuidad de Nueva York, Nueva York; Longmont, Colorado",40.71528695,-74.00310202,Space and time--Fiction; Composers--Fiction; Artists--Fiction; San Pedro de Macorís (Dominican Republic)--History--Fiction; Croix des Bouquets (Haiti)--History--Fiction; Spanish language materials--Bilingual,Espacio y tiempo--Ficción; Compositor--Ficción; Artistas--Ficción; San Pedro de Macorís (República Dominicana)--Historia--Ficción; Croix des Bouquets (Haití)--Historia--Ficción; Materiales en español--Bilingüe,Imagination; Historical figures;  Afrolatina; Afrolatine; Afrolatinx; Afro-Caribbean; Dominican Republic; Haiti; Artist; Painting; Purple; Singing; Song-writing,imaginación; personajes historicos; Afrolatina; Afrolatine; Afrolatinx; Afro-Caribeño; República Dominicana; Haití; Artista; Pintando; morado; cantando; escribiendo canciones,,Image; StillImage,image/jpeg,Arte Público Press,,,latchbo0092.jpg
latchbo0093,SofÍa and the Purple Dress,SofÍa y el vestido morado,Diane Gonzales Bertrand; Lisa Fields,"Third-grader SofÍa wants to wear a beautiful, hand-me-down dress to her cousin Rosario's quinceañera, but first she will have to lose some weight by exercising and eating healthier foods, with help from her mother and sister.",,2012,"San Antonio, Texas","San Antonio, Texas; Katonah, Nueva York",29.43045738,-98.50924795,Overweight persons--Fiction; Weight control--Fiction; Food habits--Fiction; Exercise--Fiction; Family life--Fiction; Spanish language materials--Bilingual,Personas sobrepseos--Ficción; Controlar peso--Ficción; Hábitos de comida--Ficción; Ejercicio--Ficción; Vida de familia--Ficción; Materiales en español--Bilingüe,Healthy living; exercise; Sisters; Family; Cousins; Quinceañera; Food Rainbow,Vida saludable; ejercicio; Hermanas; familia; primas; Quinceañera; arcoíris de comida,,Image; StillImage,image/jpeg,Arte Público Press,,,latchbo0093.jpg
latchbo0094,Spending Time With Dad,Mis Días con Papá,Elías David; Claudia Delgadillo,A young boy recounts the days he spends with his Dad caring for him.,,2023,"Reynosa, Mexico","Reynosa, México; Houston, Texas; Cuidad de México, México",26.05096172,-98.29380331,Fathers and sons--Fiction; Hispanic American--Fiction; Spanish language materials--Bilingual,Padres y hijos--Ficción; Hispanoamericanos--Ficción; Materiales en español--Bilingüe,Fathers; Routine; Singing; Mexico; Family; Mothers; Immigration; Immigrants,Padres; rutina; cantando; México; familia; madres; inmigración; inmigrantes,,Image; StillImage,image/jpeg,Arte Público Press,,,latchbo0094.jpg
latchbo0095,Sundays on Fourth Street,Los domingos en la calle Cuatro,Amy Costales; Elaine Jerome,"A young girl enjoys her family's weekly trip to Fourth Street, where she and her cousins eat mangos and tacos, look at clothes and shoes, watch all the people on the busy street and take care of such chores as haricuts and grocery shopping.",,2009,"Santa Ana, California","Santa Ana, California; Eugene, Oregon; Manhasset, Nueva York; Lake Tahoe, California",33.74651652,-117.8691284,Family life--Fiction; Streets--Fiction; Mexican Americans--Fiction; Spanish language materials--Bilingual,Vida de familia--Ficción; Calles--Ficción; Mexicano americanos--Ficción; Materiales en español--Bilingüe,Family; Cousins; Fourth Street; Sundays; Market; Vendors,Familia; Primos; La calle cuatro; Domingos; Mercado; Vendedores,,Image; StillImage,image/jpeg,Arte Público Press,,,latchbo0095.jpg
latchbo0096,Sunflowers,Girasoles,Gwendolyn Zepeda; Alisha Ann Guadalupe Gambino,"After helping her grandfather plant squash, onions, carrots, cabbage, and other vegetables that her mother uses in soups and salsas, seven-year-old Marisol plants sunflower seeds in her neighbors' yards, and weeks later, everyone gets to enjoy the fruits of Marisol's labor.",,2009,"Houston, Texas","Houston, Texas; Cuidad de Kansas, Missouri",29.7535998,-95.35739879,Gardening--Fiction; Grandfathers--Fiction; Hispanic Americans--Fiction; Spanish language materials--Bilingual,Jardiendo--Ficción; Abuelos--Ficción; Hispanoamericanos--Ficción; Materiales en español--Bilingüe,Sunflowers; Gardening; Planting; Sunflower seeds; Community; Neighborhoods; Schools; kindness,Girasoles; jardinando; plantando; semillas de girasoles; comunidad; barrios; escuelas; amabilidad,,Image; StillImage,image/jpeg,Arte Público Press,,,latchbo0096.jpg
latchbo0097,The Amazing Watercolor Fish,El asombroso pez acuarela,Carolyn Dee Flores,"In this bilingual poetry picture book, a fish paints what she imagines the world to look like outside the borders of her bowl to another fish. ",,2018,"San Antonio, Texas","San Antonio, Texas",29.43045738,-98.50924795,Fish--Juvenile Poetry; Painting--Juvenile Poetry; Spanish language materials--Bilingual,Pescado--Poesía juvenil; Pintando--Poesía juvenil; Materiales en español--Bilingüe,Poetry; Fish; Painting; New Friends; Imagination; Bilingual Poems; Rhyming,Poesía; Pescado; Pintando; Nuevo Amigos; Imaginación; Poesía Bilingüe; Rima,,Image; StillImage,image/jpeg,Arte Público Press,,,latchbo0097.jpg
latchbo0098,The Bakery Lady,La señora de la panadería,Pat Mora; Pablo Torrecilla,"Mónica, who wants to be a baker like her grandmother, finds the doll hidden in the bread on the feast for the Three Kings and thus gets to bake cookies for the next fiesta.",,2001,"El Paso, Texas","El Paso, Texas; Santa Fe, Nuevo México; Madrid, España",31.76083401,-106.4760287,Baking--Fiction; Cookies--Fiction; Mexican Americans--Fiction; Spanish language materials--Bilingual,Horneando--Ficción; Galletas--Ficción; Mexicano americanos--Ficción; Materiales en español--Bilingüe,Bakery; Lemon Cookies; Parties; Day of the Three Kings; Family; Grandparents; Baking,panaderías; galletas de límon; fiestas; el Día de los Tres Reyes Magos; Familia; abuelos; Horneando,,Image; StillImage,image/jpeg,Arte Público Press,,,latchbo0098.jpg
latchbo0099,The Battle of the Snow Cones,La guerra de las raspas,Lupe Ruiz-Flores; Alisha Gambino,"Ten-year-old Elena sets up a snow cone stand in front of her house, and when her friend Alma sets up a stand of her own, it creates an ever-escalating competition between the two girls to see who can outdo the other.",,2010,"San Antonio, Texas","Caliente, Texas; San Antonio, Texas; Gladstone, Missouri",29.43045738,-98.50924795,Snow cones--Fiction; Competition (Pscyhology)--Fiction; Friendship--Fiction; Hispanic Americans--Fiction; Spanish language materials--Bilingual,Raspas--Ficción; competición(psicología)--Ficción; Amistad--Ficción; Hispanoamericanos--Ficción; Materiales en español--Bilingüe,Snow Cones; Snow Cone Stand; Raspas; Best Friends; Competition;,Raspas; Hielo; Puesto de Raspas; Mejor Amigos; competición,,Image; StillImage,image/jpeg,Arte Público Press,,,latchbo0099.jpg
latchbo0100,The Boy of Maize,El niño de maize,Mario Bencastro; Christina Rodriguez,"In this version of the Mayan origin story, the child Balám travels to a village on the back of a big blue turtle, but he is preceded by a louse, a toad, a snake, and a hawk, all carrying the good news of his arrival.",,2022,El Salvador,,13.79768246,-88.8960164,Mayas--Folklore; Indians of Central America--Folklore; Spanish language materials--Bilingual,Mayas--Folklore; Personas indígenas de Centroamėrica--Folklore; Materiales en español--Bilingüe,Mayas; Animals; Folklore; Tales; Indigenous,Mayas; Animales; Folklore; Cuentos; Indígena,,Image; StillImage,image/jpeg,Arte Público Press,,,latchbo0100.jpg
latchbo0101,The Boy Who Touched the Stars,El niño que alcanzó las estrellas,José M. Hernández; Steven James Petruccio,An autobiographical account of astronaut José M.  Hernández; born to a migrant farm-working family from Mexico; he works hard in school and with the support of his parents and family pursues his lifelong dream of becoming an astronaut.,,2019,"La Piedad, Michoacán, Mexico",,20.33141988,-102.0401368,"Hernández, José M., 1962--Juvenile literature; Astronauts--United States--Biography--Juvenile literature; Hispanic American astronauts--Juvenile literatue; Migrant agricultural laborers--California--Biography--Juvenile literature","Hernández, José M., 1962--Literatura juvenil; Astronautas--Estados Unidos--Biografía--Literatura juvenil; Hispanoamericano astronautas--Literatura juvenil; Trabajadores agrícolas migrantes--California--Biografía--Literatura juvenil","Farmworkers; Migrant Farmers; Reading; School; College; Autobiography; Astronauts; future, Mexican American",Trabajadores agrícolas; agricultores migrantes; leyendo; escuela; colegio; autobiografia; astronautas; futuro; Mexicano americano; ,,Image; StillImage,image/jpeg,Arte Público Press,,,latchbo0101.jpg
latchbo0102,The Cucuy Stole My Cascarones,El Coco me robó los cascarones,Spelile Rivas; Valeria Cervantes,"Roberto and his mother made thirty dozen confetti-filled eggs, or cascarones, for guests at his birthday party, and he is sure the boogeyman--the cucuy--has stolen them along with the tamales, cake, and piñata.",,2013,"Houston, Texas","Houston, Texas; Arlington, Texas; Cuidad de México, México",29.7535998,-95.35739879,Lost and found possessions--Fiction; Neighborhood--Fiction; Birthdays--Fiction; Parties--Fiction; Mystery and detective stories; Spanish language materials--Bilingual,Objetos perdidos y encontrados--Ficción; Barrios--Ficción; Cumpleaños--Ficción; Fiestas--Ficción; Historias de misterio y detectives--Ficción; Materiales en español--Bilingüe,Mystery; Searching; Birthday Party; Confetti eggs; Community; Neighborhood;,misterio; buscando; fiesta de cumpleaños; cascarones; comunidad; barrios,,Image; StillImage,image/jpeg,Arte Público Press,,,latchbo0102.jpg
latchbo0103,The Desert is My Mother,El Desierto es mi Madre,Pat Mora; Daniel Lechón,"A poetic depiction of the desert as the provider of comfort, food, spirit, and life.",,1994,"El Paso, Texas","El Paso, Texas; Santa Fe, Nuevo México; Houston, Texas",31.76083401,-106.4760287,"Deserts--Juvenile poetry; Children's poetry, American--Translations into Spanish; Children's poetry, American; Deserts--Poetry; American poetry; Spanish language materials--Bilingual","Desiertos--Poesía juvenil; Poesía de niños, Americano--Traducciones al español; Poesía de niños, Americano; Desiertos--Poesía; Poesía americanos; Materiales en español--Bilingüe",Poetry; Rhyming; Mexican American; Desert; Nature,poesía; rima; Mexicano americano; desiertos; naturaleza,,Image; StillImage,image/jpeg,Arte Público Press,,,latchbo0103.jpg
latchbo0104,The EGGbees: A Story About Family,,Olivia Echeverria-Bis; Charmaine Echeverria Gyorkos,"On a faraway planet, the EGGerson family is visited by relatives from a nearby country, MEGGxico, and although some of their shells are brown and some are white, the cousins soon discover that they have much in common.",,2009,"Los Angeles, California","Los Angeles, California; Fresno, California; West Point, California",34.0507663,-118.2648393,Cousins--Fiction; Prejudices--Fiction; Life on other planets--Fiction; Eggs--Fiction,Primos--Ficción; Prejuicios--Ficción; La vida de otros planetas--Ficción; Huevos--Ficción,Prejudice; Diversity; Eggs; Mexico; Family,prejuicio; diversidad; huevos; México; familia,,Image; StillImage,image/jpeg,Arte Público Press,,,latchbo0104.jpg
latchbo0105,The Empanadas that Abuela Made,Las empanadas que hacía la abuela,Diane Gonzales Bertrand; Alex Pardo DeLange,"Told in the style of a cumulative folk song, a grandmother makes empanadas, a traditional Hispanic treat, for her family. Includes recipe.",,2003,"San Antonio, Texas","San Antonio, Texas; Caracas, Venezuela; Gainesville, Florida",29.43045738,-98.50924795,Mexican Americans--Juvenile fiction; Mexican American--Fiction; Empanadas--Fiction; Grandmothers--Fiction; Spanish language materials--Bilingual,Mexicano americanos--Literatura juvenil; Mexicano americanos--Ficción; Empanadas--Ficción; Abuelas--Ficción; Materiales en español--Bilingüe,Traditional food; Traditional cooking; Traditional dessert; Empanadas; Pumpkins; Mexican; Grandmothers; Folk song; Family,Comida tradicional; cocinando tradicional; postre tradicional; emapanadas; calabazas; Mexicano; abuelas; canción folclórica; familia,,Image; StillImage,image/jpeg,Arte Público Press,,,latchbo0105.jpg
latchbo0106,The Frog and His Friends Save Humanity,La rana y sus amigos salvan a la humanidad,Victor Villaseñor; José Ramírez,"In the Spring of Creation, the animals gather around a newly arrived creature and decide that it is funny and cute--a joke of Mother Nature--and work toegether to save this first human child from extinction.",,2005,"Carlsbad, California","Carlsbad, California; Los Angeles, California",33.16052951,-117.3507665,Babies--Fiction; Animals--Fiction; Human-animal relationships--Fiction; Creation--Fiction; Spanish language materials--Bilingual,Bebės--Ficción; Animales--Ficción; Humano-amimal relación--Ficción; Creación--Ficción; Materiales en español--Bilingüe,Myths; Folklore; Creation myth; Animals; Babies; Frogs,mitos; folklore; mito de creación; animales; bebės; ranas,,Image; StillImage,image/jpeg,Arte Público Press,,,latchbo0106.jpg
latchbo0107,The Gift of the Poinsettia,El Regalo de la Flor de Nochebuena,Pat Mora and Charles Ramírez Berg; Daniel Lechón,"As he participates in the festivities of Las Posadas, preparing for the birth of Christ, a young Mexican boy worries about what gift he will have for baby Jesus.",,1995,"San Bernardo, Mexico","San Bernardo, México; El Paso, Texas; Santa Fe, Nuevo México; Houston, Texas",16.82684685,-96.89890296,Christmas--Fiction; Posadas (Social custom)--Fiction; Mexico--Fiction; Spanish language materials--Bilingual,Navidad--Ficción; Posadas (Costumbre social)--Ficción; México--Ficción; Materiales en español--Bilingüe,La Posadas; Christmas; Mexican; Mexico; Poinsettias; Community; Nine nights; Candles; Gift from the Heart,Las posadas; Navidad; Mexicano; México; Flores de nochebuena; comunidad; nueve noches; velas; regalos de corazón,,Image; StillImage,image/jpeg,Arte Público Press,,,latchbo0107.jpg
latchbo0108,The Golden Flower: A Taíno Myth from Puerto Rico,,Nina Jaffe; Enrique O. Sánchez,"This myth explains the origin of the sea, the forest, and the island now called Puerto Rico.",,2005,"New York City, New York","Cuidad de Nueva York, Nueva York; Vermont",40.71497991,-74.00580197,Taino Indians--Legends; Tales--Puerto Rico; Taino Indians--Legends; Indians of the West Indies--Puerto Rico--Legends; Creation--Folklore; Folklore--Puerto Rico,Indios Tainos--Leyendas; Cuentos--Puerto Rico; Indios Tainos--Leyendas; Gente indígenas de las West Indies--Puerto Rico--Leyendas; Creación--Folklore; Folklore--Puerto Rico; Materiales en español,Folklore; Myths; Legends; Origin Story; Taíno; Indigenous; Puerto Rico;,Folklore; mitos; leyendas; cuentos de origen; Taíno; indígena; Puerto Rico,,Image; StillImage,image/jpeg,Arte Público Press,,,latchbo0108.jpg
latchbo0109,The Hero of Cinco de Mayo: Ignacio Zaragoza Seguín,El héroe del Cinco de Mayo: Ignacio Zaragoza Seguín,José Angel Gutiérrez; Stephen Marchesi,"A biographical account of Ignacio Zaragoza Seguín, the commander of the Mexican army and navy during the battle that took place on Cinco de Mayo against the French army. ","El recuento biográfico de Ignacio Zaragoza Seguín, el comandante del ejército y la naval mexicana durante la batalla que tomó lugar el Cinco de mayo contra el ejército francés.",2017,"Puebla, Mexico","Goliad, Texas; Matamoros, México; Monterrey, México; Cuidad de México, México; Puebla, México; Crystal City, Texas; Redlands, California; Las Vegas, Nevada",19.04197616,-98.20464164,"Seguín, Igancio Zaragoza--Juvenile literature; Mexican soldiers--Juvenile literature; Cinco de Mayo--Juvenile literature; Spanish language materials--Bilingual","Seguín, Igancio Zaragoza--Literatura juvenil; Soldados Mexicanos--Literatura juvenil; Cindo de Mayo--Literatura juvenil; Materiales en español--Bilingüe",Cinco de Mayo; Igancio Zaragoza Seguín; War hero; Mexico; Texas; Biography; History,Cinco de Mayo; Igancio Zaragoza Seguín; héroe de guerra; México; Texas; biografía; historia,,Image; StillImage,image/jpeg,Arte Público Press,,,latchbo0109.jpg
latchbo0110,The Land of Lost Things,El país de las cosas perdidas,Dina Bursztyn,"When he looks for his missing blue pencil, a boy enters a stranger new world which contains some very familiar objects.",,2011,Argentina,"Argentina; Cuidad de Nueva York, Nueva York",-35.08483021,-65.03633902,Lost and found possessions--Fiction; Spanish language materials--Bilingual,Objetos perdidos y encontrandos--Ficción; Materiales en español--Bilingüe,Blue Pencil; Imagination; Imaginary Worlds; Lost Objects; wonder,Lapiz azul; Imaginación; Mundos imaginarios; Objetos perdidos; maravillarse,,Image; StillImage,image/jpeg,Arte Público Press,,,latchbo0110.jpg
latchbo0111,The Land of the Riddles,La tierra de la adivinanzas,César Villarreal Elizondo; Anthony Accardo,"Sergio and Noemí find themselves transported into a strange land, where a scary woman who has betwitched many other townspeople tries to trap them with riddles they cannot answer.","Sergio y Noemí descubren que fueron transportados a una tierra extraña, donde una siniestra mujer que ha hechizado a muchas otras personas del pueblo intenta atraparlos con adivananzas que ellos no pueden resolver.",2002,"Sabinas Hidalgo, Nuevo León, Mexico","Sabinas Hidalgo, Nuevo León, México; Monterrey, México; Brooklyn, Nueva York ",26.50857521,-100.173807,Riddles--Fiction; Witches--Fiction; Fantasy; Spanish language materials--Bilingual,Adivinanzas--Ficción; Brujas--Ficción; Fantasía; Materiales en español--Bilingüe,Woods; Riddles; Brother and sister; Old woman; Witches; Reading; Grandmothers,Bosque; adivinanzas; hermanos y hermanas; la mujer vieja; brujas; leyendo; abuelas,,Image; StillImage,image/jpeg,Arte Público Press,,,latchbo0111.jpg
latchbo0112,The Last Doll,La última muñeca,Diane Gonzales Bertrand; Anthony Accardo,"A beautiful old-fashioned doll, long neglected on a toy store's shelves, becomes the last special doll given to a young girl when she celebrates her fifteenth birthday.",,2000,"San Antonio, Texas","San Antonio, Texas; Brooklyn, Nueva York",29.43045738,-98.50924795,Dolls--Fiction; Birthdays--Fiction; Mexican Americans--Fiction; Spanish language materials--Bilingual,Muñecas--Ficción; Cumpleaños--Ficción; Mexicano americanos--Ficción; Materiales en español--Bilingüe,Fifteenth Birthday; Celebration; Dolls; Latino/a Tradition; Mexican American; Family; The Last Doll Tradition,Quinceañera; Celebracion; Muñecas; Tradiciones Latino/a; Mexicanio americano; Familia; La tradición de la última muñeca,,Image; StillImage,image/jpeg,Arte Público Press,,,latchbo0112.jpg
latchbo0113,The Little Doctor,El doctorcito,Juan J. Guerra; Victoria Castillo,"Salvador assists his grandmother going to the doctor, but dislikes the way doctors care for their patients, he vows to become a doctor who speaks Spanish and English and cares about their patients.",,2017,El Salvador,"El Salvador; Los Angeles, California; Texas ",13.79768246,-88.8960164,Grandmothers and grandsons--Fiction; Healthcare--Fiction; Hispanic American--Fiction; Spanish language materials--Bilingual,Abuelas y nietos--Ficción; Cuidado de salud--Ficción; Hispanoamericanos--Ficción; Materiales en español--Bilingüe,Family; Grandmothers; Children; Doctors; Healthcare system; Immigrants; Discrimination; El Salvador,Familia; Abuelas; Niños; Doctores; Sistema de cuidado de salud; Inmigrantes; discriminación; El Salvador ,,Image; StillImage,image/jpeg,Arte Público Press,,,latchbo0113.jpg
latchbo0114,The Party for Papa Luis,La fiesta para Papa Luis,Diane Gonzales Bertrand; Alejandro Galindo,"A cumulative tale in which Papá Luis' family and friends make preparations for his brithday fiesta,complete with piñata , and a clown.",,2010,"San Antonio, Texas","San Antonio, Texas; Murcia, España",29.43045738,-98.50924795,Parties--Fiction; Birthdays--Fiction; Spanish language materials--Bilingual,Fiestas--Ficción; Cumpleaños--Ficción; Materiales en español--Bilingüe,Piñata; Birthday Party; Suprise Party; Family; Clowns,Piñata; Fiesta de cumpleaños; Fiesta de sopresa; Familia; payasos,,Image; StillImage,image/jpeg,Arte Público Press,,,latchbo0114.jpg
latchbo0115,The Patchwork Garden,Pedacitos de huerto,Diane de Anda; Oksana Kemarskaya,"Toña and her grandmother decide to start a garden on a little patch of land in the city, this encourages Toña to start a patchwork gardening club for the kids in the neighborhood.",,2013,"Los Angeles, California","Los Angeles, California; Ukraine; Canada",34.0507663,-118.2648393,Gardening--Juvenile fiction; Vegetables--Juvenile fiction; Grandmothers--Juvenile fiction; Communties--Juvenile fiction; Gardening--Fiction; Vegetables--Fiction; Grandmothers--Fiction; Community life--Fiction; Spanish language materials--Bilingual,Jardiendo--Ficción juvenil; Verduras--Ficción juvenil; Abuelas--Ficción juvenil; Comunidades--Ficción juvenil; Jardiendo--Ficción; Verduras--Ficción; Abuelas--Ficción; Vida de comunidad--Ficción; Materiales en español--Bilingüe,Grandmothers; Gardening; Neighborhood; Community; Community garden; Plants; Vegetables; Planting,Abuelas; jardineando; barrios; comunidad; huerto de la comunidad; plantas; verduras; plantando,,Image; StillImage,image/jpeg,Arte Público Press,,,latchbo0115.jpg
latchbo0116,The Place Where you Live,El lugar donde vives,James Luna; Thelma Muraida,"Simple rhyming, repetitive text describes ""the place where you live,"" from the warm and sunny kitchen smelling of tortillas and hot chocolate to the yard, neighbors, school, library, and front porch.",,2015,"San Bernardino,  California","San Bernardino,  California; Riverside, California; San Antonio, Texas",34.11160697,-117.2899378,Stories in rhyme; Home--Fiction; Spanish language materials--Bilingual,Cuentos en rima; Hogar--Ficción; Materiales en español--Bilingüe,Rhyming; Poetry; Ode; Describing; Community; Neighborhood; Family; Friends,rima; poesía; oda; describiendo; comunidad; barrios; familia; amigos; ,,Image; StillImage,image/jpeg,Arte Público Press,,,latchbo0116.jpg
latchbo0117,The Poet Upstairs,,Judith Ortiz Cofer; Oscar Ortiz,"When a poet moves into the apartment above hers, young Juliana asks to meet her and together they write poems of tropicals birds and a river that flows to the sea, typing out words that change the world, if only for a while.",,2012,"Hormigueros, Puerto Rico","Hormigueros, Puerto Rico; Athens, Georgia; Manhattan, Nueva York; Indian Trail, Carolina del Norte",18.13825998,-67.11061126,Poetry--Fiction; Authorship--Fiction; Imagination--Fiction,Poesía--Ficción; Autoría--Ficción; Imaginación--Ficción,Poetry; Poems; Typewriter; Song; Islands; Puerto Rico; Imagination; Writing,poesía; poemas; máquina de escribir; canciones; islas; Puerto Rico; imaginación; Escribiendo,,Image; StillImage,image/jpeg,Arte Público Press,,,latchbo0117.jpg
latchbo0118,The Remembering Day,El Día de Los Muertos,Pat Mora; Robert Casilla,"Long ago in what would come to be called Mexico, as Mamá Alma and her granddaughter, Bella, recall happy times while walking in the garden they have tended together since Bella was a baby, Mamá Alma asks that after she is gone her family remember her on one special day each year.",,2015,"El Paso, Texas","El Paso, Texas; Santa Fe, Nuevo México; Cuidad de Jersey, Nueva Jersey; Nueva Fairfield, Connecticut ",31.76420638,-106.4851943,Grandmothers--Fiction; Gardens--Fiction; Holidays--Mexico--Fiction; Spanish language materials--Bilingual,Abuelas--Ficción; Jardines--Ficción; Las días festivos--México--Ficción; Materiales en español--Bilingüe,Grandmothers and grandaughters; Death; Grief; Day of the Dead; Celebrating Life; Memories; Mexico; Flowers;,Abuelas y nietas; muerte; dolor; Día de los Muertos; celebrando la vida; recuerdos; México; flores,,Image; StillImage,image/jpeg,Arte Público Press,,,latchbo0118.jpg
